0,1,2,3,4,5,6,7,8
B11629498754,Экспериментальное определение материального баланса технологии СВЧ-термолиза твердых бытовых отходов,"Основным объектом исследований является печь карбонизации, которая состоит из СВЧ-генератора, соединенного металлическим волноводом и радиопроницаемой мембраной с закрытой камерой термодеструкции, обогреваемой топочными газами от сжигания газообразного топлива (сжиженный пропан-бутан). Масса разовой загрузки ТБО в камеру карбонизации составляет 20_-25__кг (крупность 1...10__мм, влажность 10_-40% масс.). Оптимальное время переработки разовой загрузки отходов в конечный товарный продукт (карбонизат, или углеродное вещество) составляет 10_-12 часов (с учетом ""холодного"" пуска печи и разогрева). В связи с расхождением теоретических расчетов и практических результатов процесса, относящегося к разряду инновационных, номинальная производительность пилотной установки может достигать 50__кг/сутки. Обнаружено, что при комбинации традиционного метода разложения отходов в закрытой камере при температуре 500_-900_0С без доступа воздуха и активации отходов электромагнитным полем частотой 2,45__ГГц общая скорость деструкции отходов сокращается на 40%, материальные затраты на топливо (при обогреве сжиженными углеводородными газами) сокращаются до 70% (расход пропан-бутана в баллонах емкостью 50__л и давлением 1,6__МПа составил 1,25_-1,5__л/час). Суммарное потребление электроэнергии составляет 0,75__кВт~xчас/кг ТБО","СВЧ\материальный баланс\отходы\разложение термическое\твердые бытовые отходы\твердые, бытовые\технология\технология СВЧ-термолиза",e5\f7\f9\f3,10Д\85\19И\ЕЕ,52.45.03\61.01.91\87.53.13,524.45.03.05\611.01.91\873.53.13.13.13,###
B1166750071X,Особенности размещения устройства обнаружения и измерения быстрых переходных процессов в сильных электромагнитных полях,"Показано, что для защиты от эл. поля высоковольтной линии измерительное устройство необходимо поместить в электростатический экран. Воздействие магн. поля на измерительное устройство можно оценить в зависимости от его взаиморасположения с силовым проводом",быстрые переходные процессы\воздействие\измерительные устройства\лаборатории высоких напряжений\размещение\электроизмерительные приборы\электромагнитные поля,e1\f9,32\22Е,44.29.37\90.27.34,441.29.37.33.13.09\901.27.34.73,###
B1167205983X,Определение горизонта на Луне и оценка его достоверности,"Представлено решение задачи об определении горизонта, видимого с поверхности Луны с заданной высоты в указанной точке. Дана оценка его качества (достоверности). Отмечается, что описанный расчетный модуль можно использовать для выбора оптимальных мест посадки лунных модулей, но необходимо учитывать, что близко расположенные высокие узкие объекты ухудшают качество построения горизонта и могут привести к исключению изучаемой базовой точки из числа пригодных для высадки.",Луна\математическое обеспечение\наблюдений обработка\наблюдения с поверхности Луны\определение горизонта\поверхность Луны\расчет мест посадки лунных модулей\спутники планет,e2,51\52,36.39.15\41.51.41,361.39.15.23.19\411.51.41.21,###
B11821216109,"Социально-эпидемиологическая характеристика населения, обратившегося за помощью после укусов иксодовых клещей в Иркутской области в 2011 г.","Проанализирована информация о случаях обращений людей в Центр диагностики и профилактики клещевых инфекций ФГБУ НЦ ПЗСРЧ СО РАМН (Иркутск) по факту укусов иксодовых клещей, произошедшей на территории Иркутской области в 2011 г.",Ixodidae (Acar.)\Иркутская область\переносчики\укусы людей\частота обращений,e3\e4,04И9\36\04Б1,34.33.23\39.25.15,341.33.23.19.05.11.09.07.15\391.25.15.17.25,###
B11823170149,Повышающий преобразователь напряжения постоянного тока,Отмечена потребность в разработке эффективных малогабаритных повышающих преобразователей постоянного тока. Рассмотрена задача синтеза системы управления периодом коммутации с целью стабилизации выходного напряжения. На основе математической модели преобразователя с применением аналитического метода синтеза нелинейных систем получено соотношение для управления. Качество синтезированного управления подтверждено путем моделирования с использованием пакета прикладных программ для решения задач технических вычислений MATLAB,малогабаритные\моделирование\преобразователи постоянного тока\разработка\силовая преобразовательная техника,f9,21Ю,45.37.31,451.37.31.01.05.07,###
B118398912800,Моделирование эффекта Холла в полупроводниковых изотропных пластинах и пленках с подвижными точечными зондами,Предложен метод измерения э.д.с. Холла на полупроводн. пластине с помощью прижимных подвижных металлич. зондов,подвижные металлические зонды\полупроводниковые приборы СВЧ\твердотельные приборы СВЧ\э.д.с. Холла,f5\e1,18Ж\24А,29.35.47\47.45.03,291.35.47.05.99\473.45.03,###
B11845948371,Оценка потенциальной помехоустойчивости сигналов в спутниковых навигационных системах,В статье приведены результаты анализа и расче~J:та потенциальной помехоустойчивости сигналов GPS/ГЛОНАСС при высоком уровне отношения сигнал/шум.,GPS NAVSTAR\ГЛОНАСС\оценка потенциальной помехоустойчивости сигналов\помехоустойчивость\расчет помехоустойчивости\спутниковые РНС\спутниковые навигационные системы,e2\e1,52\24В,36.16.35\47.49.31,361.16.35.15.15\473.49.31.04.11,###
