0,1,2,3,4,5,6,7,8
B11112592427,Симбионты мидий литорали и верхней сублиторали губы кереть Кандалакшского залива Белого моря,"В поселении на о. Большой Горелый экстенсивность и интенсивность инвазии мидий трематодами С. parvicaudata и Himasthla sp. с глубиной падает, а турбелляриями  и трематодой Gymnophallus sp. растет. Дисперсионный анализ показал достоверное влияние глубины/горизонта литорали на экстенсивность инвазии мидий турбелляриями U. cyprinae, Paravortex sp. и двумя видами трематод. C. parvicaudata, Himasthla sp. Обнаружено влияние глубины на интенсивность инвазии мидий U. cyprinae",Mytilus edulis (Moll.)\Белое море\видовое разнообразие\инвазивность\паразитофауна\трематоды\хозяева,e3\e4,04И9\07Д,34.33.23\39.19.25,341.33.23.09.07\391.19.25.31,###
B11112592451,Влияние процессов синантропизации на гельминтофауну морских птиц на примере серебристых чаек г. Мурманска,"В ходе исследования чаек обнаружено 19 видов паразитических червей, включая 10 видов трематод, 6 видов цестод и 3 вида нематод. Впервые обнаружены у морских птиц баренцевоморского региона три вида трематод Maritrema echinocirrata, Diplostomum helveticum и D. chromatophorum",Larus argentatus (Aves)\Баренцево море\Мурманск\гельминты\диагностика\морские птицы\новые находки\паразитофауна\таксономия\хозяева\чайки,e3\e4,04И9\07Д\04И11,34.33.23\34.33.27\39.19.25,341.33.23.09.15\341.33.27.19.33.21.15\391.19.25.31,###
B1111259263X,"Эндопаразитофауна ряпушки сибирской Coregonus sardinella Valenciennes, 1848 нижнего течения реки Енисей","В результате исследования ряпушки сибирской нижнего течения р. Енисея обнаружено 10 видов паразитов 4 классов. Подавляющее большинство составляют виды, промежуточными хозяевами которых являются планктонные организмы (9 видов). Выявлены возбудители таких заболеваний как язвенная болезнь лососевых (H. zschokkei), эуботриоз (E. crassum), дифиллоботриоз (D. dendriticum), триенофороз (T. crassus) и метэхиноринхоз (M. salmonis)",Иркутская область\видовое разнообразие\доминирующие виды\инвазивность\паразитофауна\промежуточные хозяева,e3\e4,04И9\07Д,34.33.23\39.19.25,341.33.23.09.09\391.19.25.31,###
B11112592702,Молекулярные аспекты взаимодействия паразит-хозяина,"Многие паразиты имеют сложный жизненный цикл, в процессе которого они меняют своих хозяев и вынуждены противостоять иммунной системе различных организмов. Для понимания эволюции паразито-хозяинных отношений в этом случае следует учитывать несколько факторов, прежде всего необходимость существования одного организма в другом. Если паразит лучше приспособлен к определенному типу иммунной системы конкретного хозяина, то в остальных случаях его существование в других организмах сопряжено с усилением его вредного действия. Иммунитет хозяина играет двоякую роль _- с одной стороны он может сдерживать рост и размножение паразита и тем самым снижать его негативное действие, с другой стороны _- иммунные реакции сами по себе достаточно сложные не только потому, что требуют больших затрат энергии, но в определенных условиях могут повреждать собственные клетки хозяина. Таким образом, вред, наносимый паразитом хозяину, будет также зависеть от типа и степени иммунных реакций хозяина и их патологических проявлений",биохимический состав\взаимодействие паразитов и их хозяев\видовая специфичность\видовое разнообразие\метаболизм,e3\e4,04И9\04Я7\36,34.33.23\39.25.15,341.33.23.11\391.25.15.17.25,###
B1111259275,Паразиты рыб в условиях техногенной трансформации водных экосистем,"Показано, что загрязнение водоема отходами горнорудной промышленности в условиях Севера приводит к резкому снижению разнообразия кишечных гельминтов рыб. Исчезают виды, находящиеся на северной периферии ареала, _- все паразиты карповых рыб, связанные своим происхождением с теплолюбивым верхнетретичным фаунистическим комплексом. Снижается разнообразие гельминтов сиговых и щуки _- типичных компонентов фауны северных олиготрофных озер. Изменяется структура разнообразия паразитов. Исчезают нематоды, личиночные стадии которых какое-то время находятся в воде, и виды трематод, использующие рыб в качестве окончательных хозяев. При минеральном загрязнении водоема сохраняются цестоды с широкой экологической валентностью (P. longicollis, T. nodulosus), жизненный цикл которых связан с веслоногими ракообразными семейства Cyclopidae. В водоеме формируются условия для стабильного цикла развития этих паразитов, определяющие их высокую численность. Сопряженность популяций паразитов и хозяев обуславливает устойчивость паразитарных систем сохранившихся видов в изменившихся внешних условиях",Карелия\абиотические факторы\взаимодействие паразитов и их хозяев\видовое разнообразие\загрязнение воды\паразиты\пищевая специализация,e3\e4,04И9\07Д,34.33.23\39.19.25,341.33.23.11\391.19.25.31,###
B11112592753,Изученность паразитических копепод рыб Вьетнама,"В морской фауне паразитических копепод побережья Вьетнама зарегистрировано 39 видов, относящихся к 21 роду, 9 семействам и 2 подотрядам. Копеподами заражены представители 4 отрядов 27 семейств 66 видов рыб. Впервые в водах Вьетнама зарегистрированы Pseudocycnus appendiculatus, Lernanthropinus gibbosus, L. sphyraenae, Lernanthropus francai, L. carangis, L. opisthopteri, L. trifoliatus. Для Pseudocycnus appendiculatus зарегистрирован новый вид хозяина _- Auxis thazard",Copepoda\Вьетнам\видовое разнообразие\диагностика\доминирующие виды\инвазивность\паразитические ракообразные\рыбы\таксономия\хозяева,e3\e4,04И9\07Д,34.33.23\39.19.25,341.33.23.19.09.09\391.19.25.31,###
B11112592826,Новые сведения о распространении типичных для минтая Theregra chalcogramma слизистых споровиков (Myxosporea) в Сахалино-Курильском районе,Полученные результаты позволили сделать следующие выводы: M. theragra и Z. hildae распространены по всей акватории Охотского моря и эти виды заражают спорами минтая средних и старших возрастных групп. Размеры спор M. theragra увеличиваются с севера на юг,Охотское море\видовое разнообразие\доминирующие виды\инвазивность\миксоспоридии\минтай\хозяева,e3\e4,04И9\07Д,34.33.23\39.19.25,341.33.23.15.15.13.11\391.19.25.31,###
B11112592834,К изучению ихтиофауны и паразитофауны рыб Красноярского водохранилища,"Полученные материалы по паразитофауне рыб Красноярского водохранилища свидетельствуют о том, что в настоящее время на водохранилище сформировался лимнофильный комплекс паразитофауны с характерными для данного типа водоема заболеваниями: лигулез, диграммоз, дифиллоботриоз, триенофороз и эргазилез",Красноярское водохранилище\видовое разнообразие\доминирующие виды\инвазивность\паразитофауна\рыбы\хозяева,e3\e4,04И9\07Д,34.33.23\39.19.25,341.33.23.09.09\391.19.25.31,###
B11112592893,"Миксоспоридии черноморских рыб в эстуарии реки Черная (Севастополь, Крым)","Установлено, что фауна миксоспоридий и микроспоридий рыб в эстуарии р. Черной по видовому составу и показателям зараженности соответствует фауне этих микропаразитов в Черном море, что свидетельствует об адаптированности исследованных видов хозяев и их паразитов к постоянному незначительному опреснению воды",Крым\видовое разнообразие\динамика численности\микроспоридии\миксоспоридии\паразитофауна\рыбы\хозяева,e3\e4,04И9\07Д,34.33.23\39.19.25,341.33.23.09.09\391.19.25.31,###
B1115376060X,"К гельминтофауне остромордой лягушки (Rana arvalis, Nilson, 1842) Юго-Западной Якутии","У остромордой лягушки Юго-Западной Якутии паразитирует 8 видов гельминтов _- 5 видов трематод (Diplodiscus subclavatus, Haplometra cylindracea, Opisthioglyphe ranae, Pneumonoeces variegates, Pleurogenoides medians) и 3 вида нематод (Rhobdias bufonis, Oswaldocruzia filiformis, Cosmocerca ornata). Несмотря на то, что гельминтофауна остромордой лягушки, обитающей в Якутии, беднее по сравнению с другими регионами (в Мордовии обнаружено 20 видов в Томской области _- девять), общими для всех являются трематода _- Opisthioglyphe ranae и нематоды _- Rhabdias bufonis и Oswaldocruzia filiformis, что свидетельствует о широком их распространении",Raha arvalis (Amph.)\Якутия\видовое разнообразие\гельминты\доминирующие виды\инвазивность\паразитофауна\хозяева,e3\e4,04И9\07Д,34.33.23\39.19.25,341.33.23.09.11\391.19.25.31,###
B111888071113,Зараженность скальных ящериц Darevskia caucasica и D. rudis гемогрегаринами Karyolysus sp. в Северной Осетии,"Зараженность D. rudis изучали в 2 относительно изолированных популяциях из Архонского и Бадского ущелий. Все изученные популяции D. caucasica экстенсивно (до 90%) и интенсивно (до 3-4 паразитов в поле зрения) заражены Karyolysus sp. (Apicomplexa, Coccidiida, Adeleidae). Но в разных популяциях морфология кровяных стадий существенно различается особенностями их воздействия на клетку хозяина. Установлено, что D. rudis заражены столь же сильно и той же морфой паразитов, что и совместно с ними обитающие D. caucasica. Это наиболее распространенная форма Karyolysus, описанная как L. lacerate. Выявлены тканевые стадии паразитов на парафиновых срезах внутренних органов ящериц, у которых найдены эритроцитарные гамонты. Более всего поражается эндотелий сосудов легких, затем печени, менее всего почек",Darevskia (Rept.)\Karyolysus (Prot.)\Северная Осетия\грегарины\диагностика\инвазивность\хозяева,e3\e4,04И9\07Д\04И11,34.33.23\34.33.27\39.19.25,341.33.23.15.15.11.13\341.33.27.17.17.33\391.19.25.31,###
B11219494554,Формирование и использование пакетных пчелиных семей в условиях нахчыванской автономной Республики Азербайджана,"В Приаразской равнинных территориях Нахчыванской АР Азербайджана пчелиные семьи развиваются рано _- уже в начале февраля матки начинают откладывать яйца. Ранняя весна и использование вспомогательных семей способствуют быстрому наращиванию силы семей, что позволяет от одной семьи в течение сезона получать 3 отводка. Показано, что от каждой пакетной семьи от 01.05.06, 10.05.06 и 23.05.06 в период основного медосбора было получено 10 кг товарного меда и собран зимний запас корма. Пакеты, полученные из семей 15.06.06, превратились в сильные семьи в середине медосбора, потому и смогли собрать мед только на зиму",Азербайджан\использование\пакетные пчелы\пчеловодство\формирование,e3,04И9,34.33.19,341.33.19.49.15.02,###
B11236712378,Гельминтофауна некоторых видов непромысловых морских рыб полуострова Камчатка,"Проведена инвентаризация и изучение гельминтов непромысловых видов рыб прибрежных вод Камчатки. Это позволит оценить роль этой группы хозяев в существовании паразитарных систем гельминтов, общих с промысловыми видами рыб, а также выявить патогенные для человека и животных виды гельминтов, паразитирующих у этой группы рыб",Камчатка\видовое разнообразие\гельминты\доминирующие виды\инвазивность\паразитофауна\промысловые рыбы,e3\e4,04И9\07Д\36,34.33.23\39.19.25\39.25.15,341.33.23.09.09\391.19.25.31\391.25.15.17.25,###
B1132915X40,Химический АСМ-фишинг белков в сверхнизких концентрациях,"Разработан метод обнаружения белков в растворе в сверхнизких концентрациях. Этот метод заключается в концентрировании молекул белка, распределенных в большом объеме анализируемого раствора, на поверхности АСМ-чипа и их ковалентном связывании в небольшой химически активированной зоне этой поверхности. Регистрация связанных молекул осуществляется при помощи АСМ в режиме счета. Этот метод носит название химического АСМ-фишинга (АСМ-НФ[Хим]), чтобы отличать его от биоспецифического фишинга, так как в случае химического фишинга не требуется использование специфических антител в качестве зондов. Высокая чувствительность такой аналитической системе обусловлена эффективным концентрированием белка и высокой чувствительностью детектора (зонда АСМ) на уровне отдельных молекул белка. Россия, НИИ биомедицинской хим. им. В.Н. Ореховича РАМН. E-mail:shum230988@mail.ru",анализ биомаркеров заболеваний\атомно-силовая микроскопия\белок\обнаружение\протеомика\сверхнизкие концентрации,e3,04Р1,62.99.07,621.99.07.61,###
B11389705130,Апофаллез и россикотремоз _- гельминтозы рыб Волгоградского водохранилища в пределах Саратовской области,"Установлена значительная инвазия рыб в условиях водохранилища, возбудителей аппофалеза и россикотремоза. В настоящее время трематоды A. muehlingi и R. donicum являются одним из ведущих компонентов паразитоценозов Волгоградского водохранилища в пределах Саратовской области. Для них характерен триксенный тип жизненного цикла со сменой в онтогенезе паразитических и свободноживущих стадий. Развитие очага гельминтов обусловлено благоприятными климатическими и гидрологическими условиями, сложившимися в последние годы в Саратовской области. Высокая температура воды и воздуха, высокая инсоляция, обширные мелководные и заросшие площади реки, способствуют увеличению численности паразитических ракообразных за счет увеличения числа генераций и ускорения циклов развития. При этом создается опасность для водоемов, имеющих рыбохозяйственное значение. Т.е. Волгоградское водохранилище является резервуаром гельминтозов рыб, способных приводить к экономическому ущербу в культурном рыбоводстве",Саратовская область\водохранилища\доминирующие виды\инвазивность\паразитофауна\рыбы\трематоды,e3\e4,04И9\07Д\04И4,34.33.23\34.33.33\39.19.25,341.33.23.09.09\341.33.33.29.11.27\391.19.25.31,###
B11389705572,Роль гидрофильных организмов в эпизоотическом процессе гельминтозной инвазии водоплавающих птиц в поозерье северной зоны Республики Беларусь,"В эпизоотическом процессе гельминтозной инвазии водоплавающих  птиц в условиях северной зоны Беларуси принимают участие гидрофильные организмы следующих таксономических групп: пресноводные моллюски, личинки насекомых, амфибии, олигохеты, пиявки, ракообразные. Самым неблагополучным по гельминтозной инвазии водоемом в Северной зоне Беларуси является озеро Ричи Браславского района, наименьшая зараженность гидрофилов личинками птичьих гельминтов отмечена в озере Глодового Поставского района",Беларусь\Республика Беларусь\видовое разнообразие\водоплавающие\водоплавающие виды\гельминты\инвазивность\паразитарные заболевания\промежуточные хозяева,e3\e4,04И9\07Д\04И11,34.33.23\34.33.27\39.19.25,341.33.23.11\341.33.27.19.33.21.15\391.19.25.31,###
B11389705580,Распространение гельминтов диких уток в северной зоне Беларуси,"В Северной зоне Беларуси гельминтофауна диких уток представлена 41 видом, из них трематод _- 13 виов, цестод _- 16 видов, нематод _- 11 видов, акантоцефал _- 1 вид. Среди диких уток отмечались паразитоценозы, состоящие из 2-8 видов гельминтов различных классов",Республика Беларусь\видовое разнообразие\водоплавающие птицы\гельминты\доминирующие виды\инвазивность\паразитофауна,e3\e4,04И9\07Д,34.33.23\39.19.25,341.33.23.09.15\391.19.25.31,###
